user_name,user_app_rating,user_review_date,company_comment_date,user_simple_comment,user_specific_comment,company_answer_check
Ha Young Jang,1,2019년 9월 2일,2019년 9월 4일,바디사진찍기에서 카메라로 촬영하기 들어가면 광각카메라로 설정이됩니다. 광각카메라로는 어깨선 무릎선 맞추기가 어려워 다시 제 핸드폰 카메라로 들어가서 기본카메라로 촬영 후 다노어플에 다시 들어가 앨범에서 선택해야합니다. 업데이트도 해보고 기존에 있던 어플 삭제 후 다시 깔아보고 혹시나 제 핸드폰 카메라 설정이 잘못되어있나 해서 카메라 초기설정도 다시 해보았는데도 똑같습니다. 매주 카메라로 사진을 찍어야하는데 너무 번거롭네요 1:1상담으로 첨부파일도 보내드리며 설명해드렸는데 아직도 똑같습니다.,no_specific_comment,answer
pyourorong pyou,4,2019년 9월 4일,2019년 9월 4일,다노 완전 좋아하는데...솔직히 통합앱은 실망이에요..북마크도 안되고 다짐하기두 안되구.좋은 의도로 통합하신건 알겠는데 지금은 쓰기가 넘 불편하구 실용적이지 못해요.별하나 남겨놨다가 그래도 지금까지 좋아하던 다노니깐 곧 더 좋아질거라 기대하며 별4개드립니다,no_specific_comment,answer
So-jeong Lee,1,2019년 8월 28일,2019년 8월 28일,"기존 다노샵 아이디가 있어서 기존아이디로 로그인 하면 로그인되면서 다시 회원가입 창이 나오고, 통합회원으로 가입하는건가 해서 가입하려고 절차를 받으면 기존 아이디가 있다고 다시 로그인창이 뜹니다. 기존아이디 로그인창 > 회원가입창 > 기존아이디 로그인창 이거의 반복이에요. 지웠다가 깔아도 그대로네요",no_specific_comment,answer
Kong free,1,2019년 9월 2일,2019년 9월 4일,업데이트 하고 오늘이 첫 수강날이었는데 앱이 너무 불안정해요 ㅠㅠ 운동을 끝까지 했는데 중간까지 한걸로 기록되고 계속 로딩 화면 뜨면서 버벅거려요 ㅜㅜ 그리고 운동영상 화질이 너무 안좋아요 ㅜㅜ,no_specific_comment,answer
강슬기,1,2019년 9월 10일,2019년 9월 11일,통합아이디 만들때 자꾸 오류가 떠서 로그인을 못하고있어요 ㅡㅡ,no_specific_comment,answer
이소연,1,2019년 9월 10일,2019년 9월 11일,프로그램이 실행이 안되요ㅜ 자꾸 로딩되고 답답하네요,no_specific_comment,answer
고뇽2,5,2019년 9월 9일,2019년 9월 9일,문제생겨서 안열렸는데 빠른답변으로 크롬업데이트 후 잘열리네요 ^^~,no_specific_comment,answer
Jeongeun Noh,2,2019년 9월 4일,2019년 9월 4일,"다노 운동과 코칭은 좋아요. 그런데 오늘 처음으로 다노샵 주문하려고 그랬더니 결제가 안되네요..? 잠깐의 오류이겠거니, 하고 다노앱 실행취소하고 다시 들어가도 결제하기에서 다음으로 안넘어갑니다.",no_specific_comment,answer
pyourorong pyou,4,2019년 9월 4일,2019년 9월 4일,다노 완전 좋아하는데...솔직히 통합앱은 실망이에요..북마크도 안되고 다짐하기두 안되구.좋은 의도로 통합하신건 알겠는데 지금은 쓰기가 넘 불편하구 실용적이지 못해요.별하나 남겨놨다가 그래도 지금까지 좋아하던 다노니깐 곧 더 좋아질거라 기대하며 별4개드립니다,no_specific_comment,answer
전진명,1,2019년 9월 3일,2019년 9월 4일,로그인오류지속 쓰라는거야 마라는거야ㅡㄷ,no_specific_comment,answer
화이니B,5,2019년 9월 3일,no_answer,말이 필요없는 앱,no_specific_comment,no_answer
김민희,5,2019년 9월 3일,no_answer,마이다노 넘나사랑해유,no_specific_comment,no_answer
송민주,2,2019년 9월 3일,2019년 9월 4일,기존 마이다노는 매거진 검색이 가능했는데 이건 안돼서 너무 불편해요.. 음주때나 영양소 등 그때그때 상황마다 검색해서 아 이렇게하면되는구나 했는데 검색이안되니까 이젠 그렇게 못해요 ...,no_specific_comment,answer
김나영,4,2019년 9월 3일,no_answer,체개적으로 잘 되어있어서 좋아요~,no_specific_comment,no_answer
채유미,5,2019년 9월 3일,no_answer,굿,no_specific_comment,no_answer
Kong free,1,2019년 9월 2일,2019년 9월 4일,업데이트 하고 오늘이 첫 수강날이었는데 앱이 너무 불안정해요 ㅠㅠ 운동을 끝까지 했는데 중간까지 한걸로 기록되고 계속 로딩 화면 뜨면서 버벅거려요 ㅜㅜ 그리고 운동영상 화질이 너무 안좋아요 ㅜㅜ,no_specific_comment,answer
남수연,1,2019년 9월 2일,2019년 9월 4일,완전 앱이 사용환경이 불안정하네요 업데이트되고나서 엄청버벅거리고 분명 영상다돌렸는데 기록이 안되어요,no_specific_comment,answer
Ha Young Jang,1,2019년 9월 2일,2019년 9월 4일,바디사진찍기에서 카메라로 촬영하기 들어가면 광각카메라로 설정이됩니다. 광각카메라로는 어깨선 무릎선 맞추기가 어려워 다시 제 핸드폰 카메라로 들어가서 기본카메라로 촬영 후 다노어플에 다시 들어가 앨범에서 선택해야합니다. 업데이트도 해보고 기존에 있던 어플 삭제 후 다시 깔아보고 혹시나 제 핸드폰 카메라 설정이 잘못되어있나 해서 카메라 초기설정도 다시 해보았는데도 똑같습니다. 매주 카메라로 사진을 찍어야하는데 너무 번거롭네요 1:1상담으로 첨부파일도 보내드리며 설명해드렸는데 아직도 똑같습니다.,no_specific_comment,answer
추지우,1,2019년 8월 31일,2019년 9월 2일,로그인하다가 빡쳐서 관뒀어요~아이디 존재하는데 없다고하고 찾기해서 힘들게 로그인햇더니 통합로그인에서 또 없는아이디로 나와요,no_specific_comment,answer
JIWOO SEO,1,2019년 8월 28일,2019년 8월 29일,하아.. 기존아이디 통합으로 안넘어감 5번 시도하다가 승질나서 지웁니다.,no_specific_comment,answer
hwhw s,2,2019년 8월 28일,2019년 8월 29일,로그인을 할려니까 없는 아이디라 하고 통합하려고 하니 중복되는 아이디라 하고 인증번호 전송하다가 시간다가네요,no_specific_comment,answer
So-jeong Lee,1,2019년 8월 28일,2019년 8월 28일,"기존 다노샵 아이디가 있어서 기존아이디로 로그인 하면 로그인되면서 다시 회원가입 창이 나오고, 통합회원으로 가입하는건가 해서 가입하려고 절차를 받으면 기존 아이디가 있다고 다시 로그인창이 뜹니다. 기존아이디 로그인창 > 회원가입창 > 기존아이디 로그인창 이거의 반복이에요. 지웠다가 깔아도 그대로네요",no_specific_comment,answer
갃섬석,1,2019년 8월 26일,2019년 8월 27일,다노샵 아이디로 로그인하려고 하면 없는 아이디라고 하고 새로 가입하려고 하면 다노샵 아이디가 있다고 하고 어쩌라는 건가요?,no_specific_comment,answer
손혜림,5,2019년 8월 24일,no_answer,조아용~ 스트레칭과 삭습관개선을 하니 다이어트 효과도 있지만 의외로 만상변비가 해결되었어요,no_specific_comment,no_answer
김민정,1,2019년 8월 18일,2019년 8월 19일,다노샵 아이디가 있다고 통합회원을 위한 절차 진행하라더니 인증번호 받으면 이미 아이디 있다고 로그인 화면이 나오는... 로그인하면 다시 통합회원 절차로 넘어가구요. 계속 반복되네요.,no_specific_comment,answer
김다솜,2,2019년 8월 14일,2019년 8월 16일,리뉴얼된 어플이 다운 받아지질 않네요ㅜ,no_specific_comment,answer
욱이,5,2019년 8월 13일,no_answer,좋아요,no_specific_comment,no_answer
Hyeyeon Kim,5,2019년 8월 13일,no_answer,운동 및 식사습관을 바로 잡는데 유용합니다,no_specific_comment,no_answer
김현숙,5,2019년 8월 13일,no_answer,정말좋은앱이요~~^^,no_specific_comment,no_answer
임수희,5,2019년 8월 13일,no_answer,좋아요,no_specific_comment,no_answer
정의,5,2019년 8월 13일,no_answer,좋아요,no_specific_comment,no_answer
서예지,5,2019년 7월 29일,2019년 7월 29일,3개월째 다이어트 성공적으로 진행하고 있어요! 그런데 업데이트 한 이후로 장바구니에 상품이 안담겨요,no_specific_comment,answer
민성현,1,2019년 7월 23일,2019년 7월 23일,어플이 자꾸잘안돼요 미션로딩중 뜨면서 화면 안뜨는게 일주일에 한두번은 꼭 있네요,no_specific_comment,answer
Mina Kim,4,2019년 7월 18일,no_answer,s헬스.걸음수가 동기화되몀 좋을것 같아요. 손에 핸드폰을 잘 안들고 다니기도하고 스마트워치가 s헬스랑.연동되다보니 실제 걸음수랑 기록되는.걸음수 차이가 발생해요,no_specific_comment,no_answer
김지아,4,2019년 7월 15일,2019년 7월 23일,만보를 찍은 다음날이면 만보걷기다짐기록도 볼 수없고 측정도안됩니다,no_specific_comment,answer
Dahyun Lee,3,2019년 7월 14일,2019년 7월 15일,"오늘 12시까지 미션 완료해야되는데 ㅜㅜㅜㅜㅜㅜ 계속 접속이 안 돼요 ㅜㅜ 얼른 해결해주세요... ㅜㅜㅜㅜ ----‐-------------------------- 결국 미션 다 못해서 실패했어요 ㅠㅠㅠ 럭키세븐 쿠폰도 걸려있는데 ㅜㅜ 완전 대박 속상 ㅜㅜㅜㅜㅜㅜ 아 ㅜㅜ 시스템 문제가 갑자기 생길 수도 있으니 당직 직원이라도 두는게 맞지 않나요.. ㅜ 온라인 PT 특성상 주말, 야간에도 진행 중인데.. 소비자가 불편함이 있어도 당장 해결을 못 하잖아요.. ㅜㅜ",no_specific_comment,answer
고우니수연,1,2019년 7월 13일,2019년 7월 15일,지금 저만 안되나여? 미션하고 운동강도 선택만 안되서 다시껏다켯는데 미션자체도 안뜨고 그래서 앱제거했다가 다시깔앗는데 이젠 로그인도 안되는데요?,no_specific_comment,answer
모나,3,2019년 7월 13일,2019년 7월 15일,지금 접속이 안되는데 다른분들도 있는거 보니 제가 해외라 그런건 아닌가봐요. 한 시간 전만 해도 되는거 봤는데?,no_specific_comment,answer
신여정,1,2019년 7월 13일,2019년 7월 15일,앱 오류때문에 삭제 후 재설치해서 로그인하려는데 로그인이 안되네요 주말에 오류나면 운동을 못하게 되는건가요...,no_specific_comment,answer
CAT쀼,3,2019년 7월 13일,2019년 7월 15일,지금 접속이 안돼요...,no_specific_comment,answer
최인영,4,2019년 7월 13일,2019년 7월 15일,어플실행이안돼요 ㅠ ㅠ 미션이안떠요 ..,no_specific_comment,answer
서유진,5,2019년 7월 11일,no_answer,쓰기쉽고 편해요!,no_specific_comment,no_answer
이수진,4,2019년 7월 6일,no_answer,마이다노어플사용하기편하긴한데 다른사람들의 식단일기도같이 볼수있었으면좋겠어요!! 식단짜기가제일어려워서 다른사람들은어떻게먹는지 보고싶어서요!,no_specific_comment,no_answer
eunah kim,5,2019년 7월 5일,no_answer,굿,no_specific_comment,no_answer
soojin lee,5,2019년 7월 5일,no_answer,아직 5일차지만 벌써 제 삶의 긍정적인 변화를 느끼고 있어요,no_specific_comment,no_answer
찬은,5,2019년 7월 5일,no_answer,잘 쓰고 있어요 ~ ^^,no_specific_comment,no_answer
Doyoung Kim,5,2019년 7월 5일,no_answer,♡다노최고,no_specific_comment,no_answer
두둥,5,2019년 7월 5일,no_answer,너무 좋아요 자극되어서 열심히하게돼요,no_specific_comment,no_answer
아니뿌니,1,2019년 7월 3일,no_answer,오랜만에 다시 어플을 다운받아 로그인하려니 통합하라고 하면서 계속 없는 아이디라고 나옵니다..어플을 종료하고 다시 실행해서 시도해도 똑같네요...아이디찾기로는 맞다고 하는데..,no_specific_comment,no_answer
hs cho,4,2019년 7월 1일,no_answer,어플너무 좋아요~ 근데 갤럭시노트9 만보걷기가 안되네요 고칠수없나요?,no_specific_comment,no_answer
정민희,1,2019년 6월 20일,2019년 6월 21일,다노샵 사용자라서 통합시킬려고 하는데 중복아이디아니라면서 완료누르면 중복아이디라며 어플이 멈추네요..................7월강의 등록하려고 들어간건데 어쩌죠ㅜ,no_specific_comment,answer
annie *,1,2019년 6월 18일,2019년 6월 18일,앱이 열리질 않습니다 ㅜ 고쳐 주세요 ㅠㅠ 돈내서 운동하는건데 안되니까 답답합니다.,no_specific_comment,answer
스콘,1,2019년 6월 17일,no_answer,계속 에러코드 502번 뜨면서 미션목록불러오기가 안되요 ㅠ 지난달도 연속수강생 등록기간에 버벅이더니 오늘은 넘 심하네요. 오전에 업데이트해서 더 그런가 싶기도 하구요.,no_specific_comment,no_answer
장효정,5,2019년 6월 17일,no_answer,갑자기마이다노안되네요....로그아웃한다음다시로그인해도실패라뜨고....어제까진잘됬는데....확인좀해주세요,no_specific_comment,no_answer
Kyungjin Woo,3,2019년 6월 17일,no_answer,업데이트 했는데도 마이다노 오늘 미션이 안떠요ㅜ 맘먹고 지금시간에 운동하려고했는데.. 베이직반인데 오늘 계속이러면 어떡하나요?,no_specific_comment,no_answer
Siwon Kim,3,2019년 6월 17일,no_answer,영상보다가 전화오거나 카톡이 오면 그냥 영상이 끊겨서 다시 봐도 기록이 업뎃이 안됨니다,no_specific_comment,no_answer
NI YO,5,2019년 6월 17일,no_answer,업데이트 이후 어플이 실행되지 않아요,no_specific_comment,no_answer
Chanmi Roh,5,2019년 6월 17일,no_answer,다노 짱,no_specific_comment,no_answer
벨스텔라,5,2019년 6월 17일,no_answer,최고최고♡♡,no_specific_comment,no_answer
장인홈트,5,2019년 6월 17일,no_answer,조아오오오,no_specific_comment,no_answer
Google 사용자,5,2019년 6월 17일,no_answer,좋아요,no_specific_comment,no_answer
김전지,5,2019년 6월 17일,no_answer,설렁설렁 스트레스 없이 적당히 운동 하기도 좋고 반대로 열성을 다해 운동하기도 좋음. 습관 개선을 코칭해주는 트레이너가 이런 가격으로 있기 힘듬.,no_specific_comment,no_answer
SO HYEUN KIM,4,2019년 6월 17일,no_answer,좋아요,no_specific_comment,no_answer
이세영,5,2019년 6월 17일,no_answer,아깝지 않을정도에요^^ 확실한 습관이 들 때까지 계속 해보려구요,no_specific_comment,no_answer
eunkyeung baek,5,2019년 6월 17일,no_answer,아주 좋아요,no_specific_comment,no_answer
신미경,5,2019년 6월 15일,no_answer,좋아요,no_specific_comment,no_answer
JH KIM,1,2019년 6월 15일,no_answer,"어제부터 계속 앱이 열리지가 않아요 운동해야하는데ㅜㅜ 물마신 거, 식사한 거 기록도 해야하는데 언능 고쳐주세요 제발 ㅜㅜ 혹시나 해서 플레이스토어에서 삭제 후 재설치했는데 여전히 ""MYDANO(이)가 계속중단""이라는 메시지만 뜨네요~ 저만그른그에요?? 😥",no_specific_comment,no_answer
Songyi Kim,1,2019년 6월 9일,no_answer,"어플 프로그램 자체는 굉장히 좋지만, 유료서비스인데 갑자기 기존 기록 내용이 다 사라지고 로그인도 안되는 건 별로입니다.",no_specific_comment,no_answer
은정박,5,2019년 6월 3일,2017년 4월 11일,의지박약 다이어터한테 넘 좋은어플입니다 저를 관리해준다는 느낌도 들고 꾸준히 할수잇게 도와주고  초보다이어터들한테 좋을것갘습니다,no_specific_comment,answer
Jiwoon Park,3,2019년 6월 1일,no_answer,로그인에서 화면이 가입란으로 바꾸네요 저만 이런것같기도 한데 무엇가를 하고 싶어도 계속 튕기네요,no_specific_comment,no_answer
pichu dawn,5,2019년 5월 29일,no_answer,마이다노 좋아요 건강하게 마인드를 바꾸는 느낌.. 아직 살은 1도 안빠졌지만 그건 제가 열심히 안해서이구요 열심히 하면 빠질 것 같아요 6월도 끊었네요 6월엔 제대로 하자!,no_specific_comment,no_answer
정Elly,1,2019년 5월 29일,no_answer,2월부터 사용했는데 지난주부터 업데이트 한다고 말만하고 되지를 않더니 오늘 업데이트 했는데 그간 내용은 싹 날아갔는지 없어졌네요····,no_specific_comment,no_answer
김수경,2,2019년 5월 28일,no_answer,물마시기 정보를 계속 불러올 수 없다고 뜨네요ㅜㅠ,no_specific_comment,no_answer
austin Lim,1,2019년 5월 26일,no_answer,남자 프로그램도 만들어주세요ㅠ,no_specific_comment,no_answer
김민선,5,2019년 5월 24일,no_answer,만보알림기능 조아요 좋은정보도 감사,no_specific_comment,no_answer
강승희,5,2019년 5월 23일,no_answer,좋아요 기대가 되요,no_specific_comment,no_answer
식빵,5,2019년 5월 23일,no_answer,조아요,no_specific_comment,no_answer
AGK,5,2019년 5월 23일,no_answer,종종 오류는 나지만 빠른 피드백에 감탄합니다. 항상 더 나은 코칭 프로그램 만들려 노력하시는게 보여서 좋아요.,no_specific_comment,no_answer
노유리,4,2019년 5월 20일,no_answer,써본결과 어플 오류가잘떠요 수강신청기간에는.. 운동효과는 봤구요,no_specific_comment,no_answer
Hyejin Yoon,3,2019년 5월 18일,2019년 5월 20일,마이다노 프로그램 너무좋은데 앱에 오류가 자주나요. 앱을 열면 당일 미션이 나와야하는데 자꾸 2일전 미션이 떠서 삭제하고 다시깔았더니 만보 카운트가 40000 이 넘고 다시 깔아도 30000이 넘어여. 게다가 물먹기다짐도 오류가 뜨네요. 수정해주세요,no_specific_comment,answer
TV Lee,1,2019년 5월 12일,2019년 5월 20일,움... 처음깔고 가입하고 실행했는데 메인 화면 외에는 모두 하얀창으로 떠서 아무런 정보나 글들을 읽을수가 없네요.... 얼른 쓰고 싶은데 이 문제를 어떻게 해결해야할지 도와주시면 감사하겠습니다 ㅜㅜ,no_specific_comment,answer
홍지희,1,2019년 5월 8일,2019년 5월 9일,다노샵기존 아이디를 가지고있는데 로그인이 안되네요.. 자꾸 통합으로 넘어가고....인증만4번이상한듯... 어떻게 해야들어갈수있을까요??,no_specific_comment,answer
윤도영,1,2019년 5월 8일,2019년 5월 9일,화가난다 아이디비번입력하니까 통합으로 넘어가고 다진행하니까 아이디가있다고나오고 무한반복이다,no_specific_comment,answer
김은지,5,2019년 5월 8일,no_answer,건강한 다이어트에 도움되는 최고 앱!,no_specific_comment,no_answer
Hyejin Park,1,2019년 5월 8일,2019년 5월 9일,기존회원이라서 로그인하면 통합가입하라고하고 인증하고나면 기존회원이라고하며 무한반복해요 로그인하게해주세요,no_specific_comment,answer
오사마반장,5,2019년 5월 7일,no_answer,6개월째 사용중인데 참 좋네옷,no_specific_comment,no_answer
김성미,2,2019년 5월 7일,2019년 5월 9일,원래 다노샵 아이디가 있고 다노 앱을 쓰다가 마이다노를 쓰려고 앱을깔았습니다.근데 회원가입하니 기존아이디로 로그인을 하라했고 로그인을 하니 이용할수없다고 나오고 회원가입도안되고 로그인도안되고 쓸수가 없어요....ㅜㅜ 어떻게 해야되나요?,no_specific_comment,answer
Helena Lee,5,2019년 5월 2일,no_answer,굿,no_specific_comment,no_answer
J J,4,2019년 4월 24일,no_answer,"수강후기를 자주보는데, 게시글을 스크롤을 내려 읽은 후 아래에있는 게시물을 클릭하면 화면이 안나옵니다. 뒤로가기해서 보고싶은 게시물을 다시 찾아서 봐야하는것이 번거롭네요 ㅜㅜ이게 저만 이상한건지..",no_specific_comment,no_answer
Anna Baker,3,2019년 4월 21일,2019년 4월 22일,나쁘지 않은데 식사일기 사진 넣을때 매번 애플리케이션 선택해야되는거 너무 불편해요ㅠ 뜰때마다 갤러리 항상을 누르는데 어떻게된게 항상 어떤 어플 쓸거냐고 팝업이 뜨네요.. 예전엔 안이랬는데ㅜㅜ 밑에 다른분 후기에도 같은 증상 있다고 하시는데 아직 안고쳐졌나봐요ㅠㅠ수정바랍니다,no_specific_comment,answer
이화영,1,2019년 4월 8일,2019년 4월 15일,전날 한것도 안보이고 심지어 오늘 미션도 보였다 안보였다 그래요. 업데이트 하고도 일주일 내내 그렇네요. 아주 불편합니다,no_specific_comment,answer
유지현,4,2019년 4월 2일,2019년 4월 3일,어플 잘 사용하고있어요! 근데 업데이트를하고 났는데도 이벤트/공지사항에 들어가면 내용이 안뜨네요ㅠㅠ 쿠폰도 발급안됬는데 됬다고 오류가뜨고..ㅠㅠ,no_specific_comment,answer
문서연,5,2019년 4월 1일,2019년 4월 1일,업데이트가 안되요 ㅜㅜ g6,no_specific_comment,answer
Ellie P,5,2019년 3월 31일,no_answer,좋아용,no_specific_comment,no_answer
Google 사용자,5,2019년 3월 31일,no_answer,굿,no_specific_comment,no_answer
Ko,5,2019년 3월 22일,no_answer,혼자 운동하려면 게을러서 안하게 되는데 그래도 옆에서 뭐라하는 사람이 있으니 조금이라도 움직이게되고 좋은것 같아요 :),no_specific_comment,no_answer
Young-don Lee,5,2019년 3월 22일,no_answer,완전 좋아요!! 올해는 건강하게!!,no_specific_comment,no_answer
Rokyoung Ann You,3,2019년 3월 15일,2019년 3월 21일,"다른 날짜 미션도 안보이고, 당일 미션도 바로바로 반영이 안돼요. 다른 날짜 갔다가 다시 돌아오면 미션리스트가 먹통이고,, 이런 상태가 지속된지 2주는 된 것 같아요.",no_specific_comment,answer
Misun Jung,3,2019년 3월 13일,2019년 3월 4일,만보기가 잘 반영을 못할때가 있어요 오전9시에서 10시 사이에 30분이상 걸었는데 전혀반영되지 않네요,no_specific_comment,answer
고라니,4,2019년 3월 11일,2019년 3월 12일,항상 잘 사용하고 있어요 마이다노!!ㅎㅎ근데 자그마한 버그가 있어요. 식단 사진 올릴때 앨범에서 선택하기를 누르면 처음에 사용할 어플리케이션을 고를수 있게 되어있고 그 앱을 항상 사용할지 선택할수 있는데요 '항상'버튼을 눌러도 다음에 또 사진을 올리려고 하면 또 그 창이 떠요..그리고 오늘 미션을 보다가 내일이나 전날 미션을 보려고 하면 미션내용이 바뀌질 않아요ㅠㅠ계속 같은 미션만 보여요...작은 버그이지만 해결되었으면 좋겠어요!!😀,no_specific_comment,answer
유우정,3,2019년 3월 7일,no_answer,기존 다노샵 아이디가 있는데요~ 로그인하면 통합하라고하고 통합인증하면 아이디있으니 로그인하라고하고 무한반복이네요ㅜㅜ 어떻게해야하나요????,no_specific_comment,no_answer
김지민,2,2019년 3월 6일,2019년 3월 6일,잘 이용하고 있어요~그런데 업데이트 이후에 저도 다른날짜 미션이 체크되질 않네요. 이번 업데이트 이전엔 그래도 왔다갔다하다보면 보였는데 오늘 업데이트 이후로 아예 안돼요ㅜ한번씩 어플 열었을때 메뉴 외에는 하얗게만 나오는 경우도 많구요.,no_specific_comment,answer
Allie JJ,2,2019년 3월 6일,2019년 3월 6일,업데이트하고나니 다른날짜 미션확인이 안됩니다.,no_specific_comment,answer
김경은,5,2019년 3월 5일,no_answer,코치상담소에서 뒤로가기를 누르면 메인화면이 안뜨고 흰색 화면으로 나와요ㅜㅜ,no_specific_comment,no_answer
문명훈,5,2019년 3월 3일,no_answer,코치님들이 너무 친절하셔서 조언듣고만 있어도 살이 빠지는 기분이에요 어디서 이런분을을 모셨는지 정말 대단합니다 하루 일정 목표량으로 안하던 운동도 하게 만드니 정말 좋은어플인것 같습니다 다소 비싼감이있지만 의지가 약하신분들은 이렇게라도 운동을 하시면 좋지요 특히 코치님들하고 친해져서 좋은 말씀 주고받으면 자존감도 높아지는것같네요 코치님들 화이팅,no_specific_comment,no_answer
Google 사용자,5,2019년 3월 2일,no_answer,굿,no_specific_comment,no_answer
미미김,3,2019년 3월 2일,2019년 3월 4일,3월 1일 만보기록이 날아갔어요ㅠㅠ 11000보 넘게 걸었는데.. 6개월 결제하고 3월 개강 기다리면서 열심히 채우는 보람이 있었는데 별거아닌거 아는데 하루 체크안된게 옥의티 같아서 너무 속상하네요..,no_specific_comment,answer
Google 사용자,2,2019년 2월 17일,no_answer,리뷰(?) 같은거 보러 가려했는데 들어가지질 않아서 짜증났어요! 다시 지워도 로그인만 되고 운동 코치도 못받아보고.. 30kg 빼야지 예뻐지는데 이거 자꾸안되서 짜등나고울었어요..ㅠ 제발 저도 좀 할 수 있게ㅜ해주세요 ㅠㅠ,no_specific_comment,no_answer
ᄋᄋ보이,3,2019년 2월 1일,no_answer,"업데이트하고 만보기가 더 이상해졌어요. 7000보에서 갑자기 122보로 줄어들고, 600보에서 또 400로 줄어들고, 지금은 120보네요.. 만보기 정확도를 개선했다고 업데이트 하라고 해서 했는데 더 이상해지고 차라리 전 버전이 나은 것 같네요...",no_specific_comment,no_answer
강지수,2,2019년 2월 1일,no_answer,저 만보기 기능이 이상해요 분명 만걸음을 다 채워서 달력있는쪽으로 돌아가 동그라미를 채우려했는데 누르자마자 만보가 안됐다면서 다시 리셋됩니다 제가 다른 만보기기능이 있는 앱이 있는데 지금 만이천보인데...고쳐줄수있나요?,no_specific_comment,no_answer
