user_name,user_app_rating,user_review_date,company_comment_date,user_simple_comment,user_specific_comment,company_answer_check
HYEJIN YU,5,2016년 8월 8일,2016년 8월 9일,보통 다이어트하면 지루하기도 한데 따로 헬스장 가지 않아도 집에서 홈트레이닝이 가능하고 그날 그날 미션도 지루하지않아서 재미있어요~! 그리고 식단에대해 그날그날 또는 잘못되었을때 코치님이 조언을 해주셔서 큰 도움이 됩니다 ㅎㅎ 코치님이랑 함께 다이어트 하는것 같아서 다음달에도 등록 할까 생각중이예요 ㅠㅠ 재밌게 다이어트 하는게 이건가봐요! 물론 꾸준히 !다이어트는 자기 자신과의 싸움이 아닐까 생각해보아요~ㅎㅎ,no_specific_comment,answer
김유나,5,2016년 8월 8일,2016년 8월 9일,돈이 안아까움ㅋㅋ헬스 pt받는거랑 크게 차이도 없고 코치님도 넘나 친절함!!,no_specific_comment,answer
lulu ASMR,5,2016년 8월 8일,2016년 8월 9일,집에서 운동하시는 분들 한테 정마 좋은 것 같아요. 저는 헬스도 다녔지만 집에서 운동하는게 잘맞아서 신청했는데 코치님이 지켜봐주시고 응원해주시니까 식단도 더열심히 지키려고 노력하고 재밌게 운동하고있어요 넘 좋습니당~^*^,no_specific_comment,answer
조은비,5,2016년 8월 8일,2016년 8월 9일,가끔 동영상 렉먹는거 빼곤 너무나 만족해용,no_specific_comment,answer
ou Tube눈꽃 Y,3,2016년 7월 29일,2016년 8월 4일,수강신청을하라는데 어디로들어가서 해야하나요?,no_specific_comment,answer
해슬,1,2016년 7월 29일,2016년 8월 4일,로그인을 어떻게 하는지 몰라서 못하고있어요,no_specific_comment,answer
지예,1,2016년 7월 27일,2016년 7월 28일,계속 안 되요,no_specific_comment,answer
김지수,3,2016년 7월 25일,2016년 7월 28일,회원가입을 어떻게 해야되나요?,no_specific_comment,answer
김윤주,1,2016년 7월 25일,2016년 7월 28일,나의다노할때 로그인을 다노햇을때의 이메일을 쓰는거 아닌가요. 자꾸 실패되요..,no_specific_comment,answer
공무원,3,2016년 7월 22일,2016년 7월 22일,에러가떠서 마지막 프로필 완료를 못하고 나왔네요 ㅠㅠ,no_specific_comment,answer
탄산고양이,3,2016년 7월 20일,2016년 7월 22일,처음 로그인하는데 정보 자잘한거  다 입력하고 완료를 누르면 서버에러발생햇다면서 완료가 안되요 ㅠㅠ 지금 이것만 5번은 입럭하고잇는데 앱을 제거햇다가 다시해봐도 똑같네요,no_specific_comment,answer
김은미,5,2016년 7월 11일,2016년 7월 14일,홈트레이닝으로아주좋아요,no_specific_comment,answer
Belle Ophelia,5,2016년 7월 11일,2016년 7월 14일,내내 실패하던 다이어트를 제대로 잡아주면서 습관을 다노하게 고쳐주고 있는 어플!! 다노짱!!,no_specific_comment,answer
달감,4,2016년 7월 11일,2016년 7월 14일,코칭은 최고인듯.,no_specific_comment,answer
김성경,5,2016년 7월 11일,2016년 7월 14일,게임퀘스트처럼 매일 주어진 미션을 해결해나가는것도 재미있고 편리하고 간단한조작법이라 큰불편없이 잘 사용하고있어요~,no_specific_comment,answer
조아라,5,2016년 7월 11일,2016년 7월 14일,코치님 말만 잘들으면 빠질것갇ㅈ음진짜,no_specific_comment,answer
김수현,5,2016년 7월 11일,2016년 7월 14일,제가 의지박약이라 매일 운동해야지해야지 하고는 막상 집에오면 피곤하다고 침대에 바로 누워버리는데 코치님이 매일 하는거 본다고 생각하시니까 운동 매일 하게되요 ..습관 만드는데 좋은 프로그램인것같아요 감사해요!,no_specific_comment,answer
Yujin Jo,5,2016년 7월 11일,2016년 7월 14일,집에서 작심삼일되기 쉬운 다이어트를 도와줘요.,no_specific_comment,answer
안장미,5,2016년 7월 11일,2016년 7월 14일,디아코치님의 코칭 좋아용♡♡,no_specific_comment,answer
강민형,5,2016년 7월 11일,2016년 7월 14일,Good,no_specific_comment,answer
lilly Jung,5,2016년 7월 11일,2016년 7월 14일,마이다노와 함께!,no_specific_comment,answer
박유현,5,2016년 7월 11일,2016년 7월 14일,나태한저에게 꼭필요한 앱..♡ 정말좋아요,no_specific_comment,answer
Sunae Ham,5,2016년 7월 11일,2016년 7월 14일,아이들때문에 밖에서 못하는 운동 다노를 통해 열심히 하고있습니다,no_specific_comment,answer
김현지,4,2016년 7월 7일,2016년 7월 14일,너무자주업데이트하지만않으면 참좋은서비스,no_specific_comment,answer
이지연,5,2016년 7월 7일,2016년 7월 14일,짱!,no_specific_comment,answer
정조제,5,2016년 7월 7일,2016년 7월 14일,다이어트에 진짜 도움되는 팁이 가득하구 개발하시는 분들도 다들 열심히 만들어주시는 것 같아요😙 짱입니다 완전 대박나세요😻,no_specific_comment,answer
다냥김,4,2016년 6월 25일,2016년 6월 27일,예전에 하다가 한동안 안했는데 이번에 다시하게 됬어요~ 좋았었던 기억이 나네요. 근대 운동영상을 다운받을수는 없을까요? 매번 집이아닌곳에서 운동할 일이 간혹 생기는데 그때마다 데이터를 써야하는게 좀 그래서요. 영구소장의 의미가 아니라 와이파이 될때 다운받아놓고 12시간이나 24시간후에는 볼 수 없겠끔요. 이게 불가능한건 아니라고 알고있어요. 왜냐면 영어공부하는데요. 거기 어플보면 강의영상을 다운을 받고 와이파이 연결안되도 볼 수 있게 해주고 일정시간후에는 다시 다운받거나 했었거든요. 다른건  다 좋네요 ^^,no_specific_comment,answer
잇히히Seo,3,2016년 6월 20일,2016년 6월 20일,요즘 좋은 무료어플도 많은데 한달10만원이면 좀더 신경써야할거같네요 전담코치가 좀 복불복인듯 두달했는데 먼저신경써주는코치가 있는반면 먼저 물어보지않는이상 의미없는화이팅이나 몇번 날리고마는 코치가있음 피드백도없고 형식적인멘트만 날리고..매크로돌리는줄..코치가 알바부업 삼아하는거란 느낌이 들때가 좀 많음 인증미션도 솔직히 의미없는게 많음 인터페이스만 업데이트하지말고 미션이나 내용이 값어치를 하게 되었음 좋겠네요,no_specific_comment,answer
ara Lee,5,2016년 6월 6일,2016년 6월 7일,다노언니가  틈틈히  피드백을 해주니 힘들어도  열심히하게 되요!   아기낳고 헬스장이나  학원갈시간이 없었는데 시간날때마다  장소구애 받지않고 아기 키우면서 할수있어서  참 좋습니다.,no_specific_comment,answer
장민교,5,2016년 6월 6일,2016년 6월 7일,피드백이 바로바로 와서 좋아용,no_specific_comment,answer
ji jim,5,2016년 6월 6일,2016년 6월 7일,절대후회하지않아요 아깝지도않구요 강추,no_specific_comment,answer
Hye-Yeon Kim,5,2016년 6월 6일,2016년 6월 7일,적극적으로 다이어트를할수있게해주네요^^,no_specific_comment,answer
여이유림,5,2016년 6월 6일,2016년 6월 7일,식단 잘못해도 운동은꾸준히하게되는듯 코치님도 묻는것에 열심히답해주시고 엄청좋은어플이에요!!앞으로도꾸준이할거같아요ㅎ,no_specific_comment,answer
김아깽,5,2016년 6월 6일,2016년 6월 7일,친절하고좋아요,no_specific_comment,answer
신해지,5,2016년 6월 6일,2016년 6월 7일,코치님이 옆에서 봐주는거같은 느낌.....,no_specific_comment,answer
이현진,5,2016년 6월 6일,2016년 6월 7일,를 알수있게해줘요 건강한 습관 바로잡기  끝판왕,no_specific_comment,answer
박선미,5,2016년 6월 6일,2016년 6월 7일,"코치님께 찔리지 않기 위해서라도 운동, 식단 꾸준히 실천하게 되네용ㅎㅎ 또 그렇게 하니까 아직 일주일밖에 안되었지만 조금씩 효과도 있는것 같구 재미도 있어요!!",no_specific_comment,answer
Ji Hui Yun,5,2016년 6월 6일,2016년 6월 7일,친절한 설명과 함께 다이어트하기에 딱 적합한 앱이에요!,no_specific_comment,answer
장미나,4,2016년 6월 6일,2016년 6월 7일,다만 설명이랑 동작이 싱크가 잘 안맞네요,no_specific_comment,answer
최수정,5,2016년 6월 6일,2016년 6월 7일,정말 홈트레이닝을 하고싶은데 혼자선 자신이 없다면 마이다노가 최고인듯,no_specific_comment,answer
yoon yen,5,2016년 6월 6일,2016년 6월 7일,앞자리 6에서 5넘어가는게 너무힘들고 시험기간에 폭식해서 요요올까봐 신청해서 하게됐는데 이제 1주일됐는데 바로 앞자리 5로바뀌고 바지가 맞기시작했어요!!  인바디했더니 체지방은 빠지고 근육량은 늘어서 진짜 감탄중이에요. 저같은경우는 몰라서 살을 못뺀것 보다는 알아도 귀찮고 힘들어서 못뺐었는데 코치님이 진짜 신경 많이 써주셔서 엄청 즐겁게 다이어트하고 있어요~  다노 완전 강추!!!,no_specific_comment,answer
ji min pyeoung,5,2016년 6월 6일,2016년 6월 7일,약물로 다욧하다 다노 프로그램 신청해서 하는 중인데 몸이 달라지는게 훅훅 느껴집니다. 건강한 다욧을 위해 선택한 다노!! 최고에요:),no_specific_comment,answer
윤정원,5,2016년 5월 30일,2016년 5월 30일,정말 언제나  운동동영상보고 보고만있어도 지쳐서 하지도않았는데 이앱은 제몸을 움직일수있게 해주었던 유일한 앱이예요~작심3일이 아닌 꾸준히 운동을 할수있게 해주는... 글구  무엇보다도  보다 건강해지는게 눈으로 확인되는게 무엇보다 좋았어요~^^ 선생님께 감사드려요!,no_specific_comment,answer
유지의내맘대로TV,2,2016년 5월 29일,2016년 5월 30일,유료네요...ㅜㅜ인터넷수강은 얼마에요?,no_specific_comment,answer
김치부침개,3,2016년 5월 20일,2016년 5월 30일,지메일계정이안만들어져서 여기씁니다  예전보다 영상버퍼링이심하고 자막을꺼도꺼도 자꾸 자막이자동으로켜지네요 운동재생시켜놓고다했는데 중간에 몇초덜했다고나오고 그러네요  백퍼로채우려면처음부터다시봐야되는데 불편하네요,no_specific_comment,answer
신수정,5,2016년 5월 9일,2016년 5월 19일,코치님이 운동프로그램도 짜주고 격려도 해줘서 좋아요,no_specific_comment,answer
ji hee park,5,2016년 5월 9일,2016년 5월 19일,건강한 생활습관 형성 굳굳,no_specific_comment,answer
Hana Kim,5,2016년 5월 9일,2016년 5월 19일,도움됩니다😄,no_specific_comment,answer
o se,5,2016년 5월 9일,2016년 5월 19일,일주일만에 느껴지네요 ㄷㄷㄷ,no_specific_comment,answer
정보름,5,2016년 5월 9일,2016년 5월 19일,헬스장 가긴 어렵고 집에서 무슨운동을 해야할지 모를때!!  정말 많은 도움을 주는 앱이에요!!!!,no_specific_comment,answer
황효원,4,2016년 5월 9일,2016년 5월 19일,멘탈잡는데 좋아요. 영상도 좋고요,no_specific_comment,answer
구현경,5,2016년 5월 9일,2016년 5월 19일,다노언니의 잔소리가 점점 더 좋아져요. 역시 힘든 건 나눌수록 반이 되는 거 같아요! 더 다양한 프로그램이 나왔으면 좋겠습니다~!,no_specific_comment,answer
rorong ta,4,2016년 4월 21일,2016년 4월 21일,안녕하세요 3개월간 마이다노 수강했었는데요 전에는 수강했던 프로그램 조회및 내용확인이 터치하면 볼 수 있었는데 지금은 들어갈때마다 로그인해야하고 터치를하면 바로 오류라면서 강제종료됩니다ㅠㅠ 이거 해결해주셨으면 좋겠어요!,no_specific_comment,answer
HIME _,5,2016년 4월 12일,2016년 4월 12일,"혼자 관리하는게 어려웠는데 매일 오는 미션이랑 운동이 도움이 정말 많이 되고  무엇보다 건강한 식습관을 만들 수 있어서 좋아요!무조건 닭가슴살,고구마,야채,과일로 떼우는 식사가 아니라 영양적으로 균형잡힌 식단을 적당한 양만큼 먹게돼서요.",no_specific_comment,answer
307 smile,5,2016년 4월 11일,2016년 4월 12일,정말 PT하듯 봐주시고 초보자도 따라하기 쉬워요 저는 만족입니다,no_specific_comment,answer
두두,5,2016년 4월 11일,2016년 4월 12일,미션클리어해가며 뿌듯뿌듯 코치님도 넘 친절하세요 ♡,no_specific_comment,answer
뀨뀨,5,2016년 4월 11일,2016년 4월 12일,제 돈 내고 하는건데 비용에 비해 정말정말 좋은 거 같아요♥ ㅎㅎ,no_specific_comment,answer
유시안,5,2016년 4월 11일,2016년 4월 12일,매번 혼자하는 다이어트 며칠 가지 못했는데 좋은 프로그램과 좋은 코치님 덕에 모두 수행하며 잘해나가니 라인이 달라지네요 이제 시작이라 열심히 계속 해보려구요 ^ ^ !!,no_specific_comment,answer
노윤정,5,2016년 4월 11일,2016년 4월 12일,다이어트 혼자서 하려면 자꾸 게을러지는데 마이다노 하면서 든든한 지원군이 생긴것 같고! 넘 좋아요^^,no_specific_comment,answer
박보민,5,2016년 4월 11일,2016년 4월 12일,마치옆에있는듯 일대일 관리해주고 체계적으로ㅡ 생활패턴변화되도록 프로그램이 짜여져서좋아욤,no_specific_comment,answer
장세미,5,2016년 4월 11일,2016년 4월 12일,마이다노하며 일주일만에 1kg 허리 3cm줄엇네요ㅎㅎ 시험삼아 한달햇는데 앞으로 꾸준히 해보려구요^^,no_specific_comment,answer
Yunji Oh,5,2016년 4월 11일,2016년 4월 12일,흐트러지는 마음 다잡아주는 어플이지만 친구같이 가까운 느낌^^ 좋아요 ~~~,no_specific_comment,answer
김태은,5,2016년 4월 11일,2016년 4월 12일,2월달에 첨으로 시작해서 2월달엔 거의 미션을 못함에도 불구하고 코치님이 계속 코칭해주고 끌어주셔서 3월 .4월까지 총 8키로 빠졌네요 ㅎㅎ물론 3월달 미션도 100%달성하구요 ㅎㅎ마이다노가 있어 요요없는 건강한 다이어트 하고있습니당^^감사해용 ㅎㅎ,no_specific_comment,answer
권민정,5,2016년 4월 11일,2016년 4월 12일,매일 미션과 사진도찍고 운동영상도 있어서 빠짐없이 끝까지할수있아서 좋아요!!,no_specific_comment,answer
김지수,5,2016년 4월 11일,2016년 4월 12일,넘나 자세한 설명 꼼꼼한체크!! 의지박약인 저에게 넘나 도움이됩니당!!,no_specific_comment,answer
김다희,5,2016년 4월 11일,2016년 4월 12일,마이다노 앱 최고! 다노언니 최고!!,no_specific_comment,answer
강수진,5,2016년 4월 11일,2016년 4월 12일,함께해서 좋아요,no_specific_comment,answer
yj h,5,2016년 4월 11일,2016년 4월 12일,짱좋아요 매일 관리해주고 운동도 할수있도록 도와줘요 코치님도 너무좋아요♡,no_specific_comment,answer
이연명,5,2016년 4월 11일,2016년 4월 12일,운동안하는데 이앱덕분에운동하게되네요!!,no_specific_comment,answer
박정원,5,2016년 4월 11일,2016년 4월 12일,매우 도움됨:)♥,no_specific_comment,answer
김정아,5,2016년 4월 11일,2016년 4월 12일,"다노(분홍이)어플 나오기전부터 다노를 알았고, 쭉 써오고 있는 사람입니다. 늘 알차게 업데이트 될 때마다 흐뭇했는데 마이다노는 이번에 맘잡고 신청해봤어요. 정말 어플만으로 코칭이 될까 싶었는데 하루하루 안 빼먹고 챙겨주시는 코치님과 알차고 지루하지 않은 미션들, 그리고 충분히 맨몸으로 운동량을 채울 수 있는 프로그램들을 통해 건강한 생활습관 잡고있어요. 전 진짜 만족합니다!♥! 다음달에도 여유만 된다면 한번 더 수강해보고 싶어요.",no_specific_comment,answer
asdasd asd,5,2016년 4월 11일,2016년 4월 12일,정말 너무 좋아요~,no_specific_comment,answer
희원,1,2016년 4월 10일,2016년 4월 12일,이거 회원가입어떻게 함,no_specific_comment,answer
김민지,5,2016년 4월 7일,2016년 4월 12일,다노덕분에폭식증 고쳐지고있습니당!!,no_specific_comment,answer
달지,5,2016년 4월 7일,2016년 4월 12일,공짜인것보다 오히려 돈을 냈기때문에 효과가 배가 되는 것 같아요. 사람마다 다르겠지만 저한테는 가격 대비 효과가 좋은 듯 합니다,no_specific_comment,answer
SoYoung Ryu,5,2016년 4월 5일,2016년 4월 12일,메모란에 입력하고 글 수정하면 시간이 오전 0시로 바뀌는 오류가 있습니다. 앱 오류 수정부탁드려용 ㅎㅎ 마이다노 자체는 정말 좋아요!,no_specific_comment,answer
박지예,5,2016년 3월 14일,2016년 3월 15일,정말 혼자서 하기힘든 사람들에게 추천해요~~ 헬스3개월 끊는것보다 훨씬 나아요!,no_specific_comment,answer
한수경,5,2016년 3월 14일,2016년 3월 15일,다노 너무 좋아요♡,no_specific_comment,answer
홍자연,5,2016년 3월 14일,2016년 3월 15일,게으른저도운동하게만들어주는 다노언니!!! 감사해요 코치님,no_specific_comment,answer
이서하,5,2016년 3월 14일,2016년 3월 15일,최고의어플,no_specific_comment,answer
JangMi Lim,5,2016년 3월 14일,2016년 3월 15일,"코치님이랑 실시간 상담도 하고, 잘짜여진 프로그램 ! 이대로 잘 따라하기만 하면 다이어트는 성공적일듯하네요!!",no_specific_comment,answer
Centercat,5,2016년 3월 14일,2016년 3월 15일,미션 수행하는 맛이 쏠쏠합니다 ㅋㅋ 제가 하고 있는 미션에 몇명이 오늘 완수했는지도 떠서 안보이는 사람들과 경쟁심리도 붙어요.,no_specific_comment,answer
Ji Eun Kim,5,2016년 3월 14일,2016년 3월 15일,누군가의 모니터링이 날 부지런하고 의지있게 만들어 주네요. 매일 미션 완료하고나면 점점 건강해진 나를 느낌니다. 코치님 감사해요~♥,no_specific_comment,answer
Ji seon Lee,5,2016년 3월 14일,2016년 3월 15일,좋아요,no_specific_comment,answer
주예경,5,2016년 3월 14일,2016년 3월 15일,마이다노때문에 지루하지않게 하루하루 미션성공하는 낙으로 살고있습니다!! 1대일 대화를 통해서 궁금한것도 여쭤보고 제몸상태에 따라서 운동도 조절할수 있어서 좋아요!! 마이다노로 제 목표치에 꼭 성공하고싶어요!!,no_specific_comment,answer
Ga Eun Lee,5,2016년 3월 14일,2016년 3월 15일,코치님 감사해여 pc에서도 더 잘되면 좋겠고 다노어플이랑도 개연성이 더 있음 좋겠어용,no_specific_comment,answer
장미진,4,2016년 3월 14일,2016년 3월 15일,반신반의했는데 매일매일 지루하지 않게 운동과 미션이 달라서 재미있구요~ 다노언니들과 실시간 대화로 P.T받는 느낌이에요^^ 미션을 미루지만 않으면 건강하게 다이어트할 수 있어요~,no_specific_comment,answer
정다운,5,2016년 3월 14일,2016년 3월 15일,식단 운동 모두 관리해주시고 무엇보다 작심삼일이 되지않게 도와주시는게 너무 좋아요,no_specific_comment,answer
Sophia Kim,5,2016년 3월 14일,2016년 3월 15일,"마이다노는 홈트레이닝으로도 얼마든지 건강한 다이어트가 가능하다는 걸 증명해줍니다. 마이다노의 장점은 우선, 의지만 있다면 개인에게 맞는 난이도로 누구나 따라하기 쉽습니다. 또한, 마이다노 프로그램이 끝난 후에도 스스로 할 수 있게끔 식습관과 운동습관을 길러줍니다. 최고!♡",no_specific_comment,answer
블리뚬,5,2016년 3월 14일,2016년 3월 15일,짵,no_specific_comment,answer
우아미,5,2016년 3월 14일,2016년 3월 15일,"살이 찌고 나서 건강과 외모,사람까지 잃었어요. 다노코칭 8일차인데, 프로그램이 탄탄하고 부담스럽지 않아서 매일 포기않고 하고 있답니다. 다른 사람들과의 경쟁심도 은근 생겨서 작심하루였던 제가 변해가는 것 같아요. 코치님이 항상 지켜보고 있으니 더 열심히 하게 됩니다. 전 6개월정도 코칭 받기를 쭉 할 계획이예요",no_specific_comment,answer
김현영,5,2016년 3월 14일,2016년 3월 15일,그저고마울뿐입니다,no_specific_comment,answer
김 의성김의성,3,2016년 2월 12일,2016년 2월 15일,회원가입어떻게해요,no_specific_comment,answer
Kassy Kim,4,2016년 2월 8일,2016년 2월 15일,아직일주일차라 큰변화는 없지만 만은조언과 퀘스트 덕분에 느끼는것도많고 정확한정보도 생깁니다. 한달후 변화가생긴다면 별다섯개 주고싶네요~!,no_specific_comment,answer
김아람,5,2016년 2월 8일,2016년 2월 15일,마이다노 진짜 최고:) 코치 쌤 정말 최고에요!,no_specific_comment,answer
에스더,5,2016년 2월 8일,2016년 2월 15일,"저는 작심삼일의 대명사와도 같았는데, 매일 누군가가 지켜보고 응원해주고.  운동루틴을 짜주니 꾸준히 할 수 있게 되는것 같아요. 다이어트하는데 도움이 많이 돼요!ㅎㅎ",no_specific_comment,answer
전혜린,4,2016년 2월 8일,2016년 2월 15일,습관형성에 좋습니다!,no_specific_comment,answer
최뽀로리,5,2016년 2월 8일,2016년 2월 15일,틈틈히 지켜보고있다는 기분 때문에 조절하기도 쉽고 작심삼일이던 다이어트를 계속 유지할 수 있습니다♡,no_specific_comment,answer
김가람,5,2016년 2월 8일,2016년 2월 15일,넘나 좋은 것!,no_specific_comment,answer
키티똥,5,2016년 2월 8일,2016년 2월 15일,좋아요좋아,no_specific_comment,answer
Eunice Choi,5,2016년 2월 8일,2016년 2월 15일,"식단, 운동, 의지까지 다잡아주시는데, 꼭 바로 옆에서 따라다니며 해주시는듯한 기분이예요~ 미션까지 매일매일 성공시키면서 더 동기부여가 팍팍되네요~ 몇달 고민하다 시작해봤는데 엄청 만족스러워요~",no_specific_comment,answer
최유진,5,2016년 2월 8일,2016년 2월 15일,(^o^)b 굳,no_specific_comment,answer
이영담,5,2016년 2월 8일,2016년 2월 15일,완전좋아요 관리짱 역시 다이어트는 누가옆에서 봐줘야하나봐요ㅎㅎ,no_specific_comment,answer
박성현,5,2016년 2월 8일,2016년 2월 15일,제가 잘 따라하기만하면 될듯 ㅜㅜ,no_specific_comment,answer
Young Mi LEE,5,2016년 2월 8일,2016년 2월 15일,다노는 #사랑 입니다. 세상에 이런 앱은 없었다!!!,no_specific_comment,answer
문지선,5,2016년 2월 8일,2016년 2월 15일,좋습니다,no_specific_comment,answer
gkgkgkro,5,2016년 2월 8일,2016년 2월 15일,내의지만있으면다돼용,no_specific_comment,answer
j e,5,2016년 2월 8일,2016년 2월 15일,좋아요,no_specific_comment,answer
JiHye Kang,5,2016년 2월 8일,2016년 2월 15일,습관변화가 진짜로 가까이 다가오는 느낌입니다!!,no_specific_comment,answer
최수형,5,2016년 2월 8일,2016년 2월 15일,진짜 PT를 매일 받는 기분!!,no_specific_comment,answer
채소영,5,2016년 2월 8일,2016년 2월 15일,도움이 많이되요!,no_specific_comment,answer
걸어꽃길만,5,2016년 2월 8일,2016년 2월 15일,일대일로 코치도 받고 칭찬도 받고 담달에 또 하고 싶을 정도로 좋습니다 👍👍👍,no_specific_comment,answer
김은진,5,2016년 2월 8일,2016년 2월 15일,정말 좋음 !의지박약이 사라짐!!정말 효과좋음,no_specific_comment,answer
Heuijung Shin,4,2016년 1월 28일,2016년 2월 15일,회원가입을 어떻게 하는거죠..?어디를 눌러야하는지모르겠어요ㅠㅠ,no_specific_comment,answer
[익명작가]옌작가,1,2016년 1월 25일,2016년 1월 26일,로그인하라는데  회원가입이 없나요?,no_specific_comment,answer
조민지,3,2016년 1월 20일,2016년 1월 21일,가입 하는 곳이 없네요 ㅠㅠ,no_specific_comment,answer
이린리,5,2016년 1월 19일,2016년 1월 21일,계속 오류뜨고 운동 기록도 안되요ㅠㅠ,no_specific_comment,answer
Rachel Kim,5,2016년 1월 11일,2016년 1월 18일,내가 먹은 음식들이 어디에 도움이 되는지 알려주시고 부족한 영양소 항상 짚어주시니 영양소 챙기는데에 도움을 주셔서 좋다 그리고 할 수 있다라는 긍정적인 생각도 심어주시니 자신감도 생겨서 좋다! 그리고 잘한 부분에 대해서는 아낌없는 칭찬!,no_specific_comment,answer
박지원,5,2016년 1월 11일,2016년 1월 18일,왜냐하면최고이기때문,no_specific_comment,answer
경미윤,5,2016년 1월 11일,2016년 1월 18일,마치 옆에서 코치하는듯해서 신경쓰면서 지내게 되네여~,no_specific_comment,answer
이수정,5,2016년 1월 11일,2016년 1월 18일,코치언니 좋아요♡,no_specific_comment,answer
최지현,5,2016년 1월 11일,2016년 1월 18일,설명도 잘해주시고 이렇게라도 운동하니까 훨씬 좋아요,no_specific_comment,answer
봄이다,5,2016년 1월 11일,2016년 1월 18일,"하루하루 식단과 미션, 운동까지 잡아주는 만능앱으로 만족👍",no_specific_comment,answer
김태희,5,2016년 1월 11일,2016년 1월 18일,모르는거 가르쳐주시고 미션 달성하는 것도 재밌어요. 몸도 달라지는것같고 후회안해요,no_specific_comment,answer
박혜라,5,2016년 1월 11일,2016년 1월 18일,할때마다느끼지만 쵝오쵝오,no_specific_comment,answer
sunny kim,4,2016년 1월 11일,2016년 1월 18일,좋은 습관을 가지게 해주는 다노!,no_specific_comment,answer
Chae Min Kim,5,2016년 1월 11일,2016년 1월 18일,의심반 기대반으로 시작했는데 잘했다는 생각이들어요 옆에서 계속 지켜보든듯하고 꼼꼼히 체크해주고 미션수행하는 재미까지 솔솔~~,no_specific_comment,answer
